{
  "schema": "rusty.quest.workflow.meta_tooling_profile_registry.v1",
  "profile_set_id": "meta-vr-cli-evidence-profiles-20260803",
  "provider": {
    "id": "meta-vr-cli-pinned",
    "npm_package": "metavr",
    "npm_package_version": "1.3.2",
    "observed_cli_version": "metavr 1.3.2.2.2",
    "package_integrity_sri": "sha512-J3V0F+0e48Jd6Huxtcim6881Iw5kgLEBK+n4mamsG6LMBOE9ScEMomjHhKphtMkIsf6ViyI4PmrwtdG6SmZvFQ==",
    "package_dist_shasum_sha1": "66a9ce615ad7388e28faf44f1b9a03f256f6191f",
    "capability_reference": {
      "kind": "normalized-markdown-help",
      "line_endings": "lf",
      "terminal_newline": true,
      "sha256": "47b98fc99a544216975d7614b568ce41b5195b2a4c7d4a8f9a3ea6cac266e366",
      "size_bytes": 85230
    }
  },
  "verification": {
    "checked_at_utc": "2026-08-03T11:30:00Z",
    "state": "tooling-surface-verified",
    "device_used": false,
    "sources": [
      "https://github.com/meta-quest/agentic-tools",
      "https://github.com/meta-quest/agentic-tools/blob/main/docs/hzdb.md",
      "https://developers.meta.com/horizon/documentation/unity/meta-xr-operator/",
      "https://developers.meta.com/horizon/documentation/unity/meta-xr-operator/quest/"
    ]
  },
  "operator_scope": {
    "classification": "optional-app-scoped-instrumentation",
    "generic_device_oracle": false,
    "production_authority": false,
    "requires_target_app_integration": true,
    "claim_class": "app-diagnostic-only"
  },
  "profiles": [
    {
      "id": "health",
      "provider_recipe_id": "health",
      "authority": "transport-observed",
      "config": {
        "provider_route": "device-health-check",
        "output_format": "json",
        "deadline_ms": 30000
      },
      "config_canonical_json": "{\"provider_route\":\"device-health-check\",\"output_format\":\"json\",\"deadline_ms\":30000}",
      "config_sha256": "ab39455eb11a54fba8abec92df30e55dbddfb71e3a22c213d96a096ce1d21de8",
      "artifact_paths": [
        "artifacts/meta-tooling/<run-id>/health/stdout.json",
        "artifacts/meta-tooling/<run-id>/health/stderr.txt"
      ],
      "metric_summary": [
        { "id": "provider-exit-code", "unit": "count", "required": true },
        { "id": "health-check-status", "unit": "state", "required": true },
        { "id": "battery-percent", "unit": "percent", "required": false },
        { "id": "storage-free-bytes", "unit": "bytes", "required": false },
        { "id": "ui-ready", "unit": "boolean", "required": false }
      ],
      "cleanup": {
        "required": false,
        "receipt_status": "not-required",
        "checks": ["provider-process-exited", "no-run-owned-forward"]
      },
      "claim_limits": [
        "Does not prove app readiness, OpenXR state, renderer output, or wearer-visible state."
      ]
    },
    {
      "id": "logcat",
      "provider_recipe_id": "logcat",
      "authority": "diagnostic-only",
      "config": {
        "provider_route": "bounded-logcat-snapshot",
        "output_format": "plain",
        "line_limit": 1000,
        "clear_before": false,
        "deadline_ms": 60000
      },
      "config_canonical_json": "{\"provider_route\":\"bounded-logcat-snapshot\",\"output_format\":\"plain\",\"line_limit\":1000,\"clear_before\":false,\"deadline_ms\":60000}",
      "config_sha256": "72e1e76fc36b367e9fe95553174008b2f059c920426d1c8ef54cde8dc67cb6d1",
      "artifact_paths": [
        "artifacts/meta-tooling/<run-id>/logcat/logcat.txt",
        "artifacts/meta-tooling/<run-id>/logcat/stderr.txt"
      ],
      "metric_summary": [
        { "id": "provider-exit-code", "unit": "count", "required": true },
        { "id": "line-count", "unit": "count", "required": true },
        { "id": "fatal-exception-count", "unit": "count", "required": true },
        { "id": "anr-count", "unit": "count", "required": true },
        { "id": "native-crash-count", "unit": "count", "required": true }
      ],
      "cleanup": {
        "required": false,
        "receipt_status": "not-required",
        "checks": ["provider-process-exited", "log-buffer-preserved"]
      },
      "claim_limits": [
        "A bounded log snapshot can miss earlier events and does not prove application acceptance."
      ]
    },
    {
      "id": "screenshot",
      "provider_recipe_id": "screenshot",
      "authority": "diagnostic-only",
      "config": {
        "provider_route": "still-screenshot",
        "method": "screencap",
        "width_px": 1024,
        "height_px": 1024,
        "output_format": "json",
        "deadline_ms": 60000
      },
      "config_canonical_json": "{\"provider_route\":\"still-screenshot\",\"method\":\"screencap\",\"width_px\":1024,\"height_px\":1024,\"output_format\":\"json\",\"deadline_ms\":60000}",
      "config_sha256": "8de63fbdb28ebab0e417c51811a69d7f889c82ecd970cbb4d94e793f4f173e87",
      "artifact_paths": [
        "artifacts/meta-tooling/<run-id>/screenshot/screenshot.png",
        "artifacts/meta-tooling/<run-id>/screenshot/provider.json",
        "artifacts/meta-tooling/<run-id>/screenshot/stderr.txt"
      ],
      "metric_summary": [
        { "id": "provider-exit-code", "unit": "count", "required": true },
        { "id": "png-bytes", "unit": "bytes", "required": true },
        { "id": "width-px", "unit": "pixels", "required": true },
        { "id": "height-px", "unit": "pixels", "required": true },
        { "id": "non-black-sample-status", "unit": "state", "required": false }
      ],
      "cleanup": {
        "required": false,
        "receipt_status": "not-required",
        "checks": ["provider-process-exited", "no-run-owned-forward"]
      },
      "claim_limits": [
        "A black or partial screenshot can still be a successful transport capture and is not a wearer-visible or app-owned visual oracle."
      ]
    },
    {
      "id": "xr-frame-pacing",
      "provider_recipe_id": "perfetto-vr",
      "authority": "diagnostic-only",
      "config": {
        "provider_route": "perfetto-vr-capture",
        "mode": "vr",
        "duration_ms": 10000,
        "maximum_duration_ms": 30000,
        "analysis_focus": "frames",
        "output_format": "json",
        "deadline_ms": 120000
      },
      "config_canonical_json": "{\"provider_route\":\"perfetto-vr-capture\",\"mode\":\"vr\",\"duration_ms\":10000,\"maximum_duration_ms\":30000,\"analysis_focus\":\"frames\",\"output_format\":\"json\",\"deadline_ms\":120000}",
      "config_sha256": "804f9eaa49131ba72c61a94cc62398e7b8c69d58cb3f301f75fb3a3f634c8bdf",
      "artifact_paths": [
        "artifacts/meta-tooling/<run-id>/xr-frame-pacing/xr-frame-pacing.pftrace",
        "artifacts/meta-tooling/<run-id>/xr-frame-pacing/capture.json",
        "artifacts/meta-tooling/<run-id>/xr-frame-pacing/frames-summary.json",
        "artifacts/meta-tooling/<run-id>/xr-frame-pacing/stderr.txt"
      ],
      "metric_summary": [
        { "id": "provider-exit-code", "unit": "count", "required": true },
        { "id": "capture-duration-ms", "unit": "milliseconds", "required": true },
        { "id": "frame-slice-count", "unit": "count", "required": false },
        { "id": "missed-frame-count", "unit": "count", "required": false },
        { "id": "app-frame-time-p50-ms", "unit": "milliseconds", "required": false },
        { "id": "app-frame-time-p95-ms", "unit": "milliseconds", "required": false }
      ],
      "cleanup": {
        "required": true,
        "receipt_status": "required",
        "checks": [
          "provider-process-exited",
          "trace-capture-inactive",
          "no-run-owned-forward",
          "no-run-owned-device-file"
        ]
      },
      "claim_limits": [
        "Perfetto frame analysis is diagnostic evidence and does not replace app-owned frame counters, OpenXR session state, or compositor-visible confirmation.",
        "Optional normalized metrics must be marked not-reported when the pinned provider does not emit a corresponding value."
      ]
    }
  ]
}
